{
  "decision_id": "study-decision-synth-onco-001-teae",
  "schema_version": "1.1.0",
  "version": "1.0.0",
  "study_id": "SYNTH-ONCO-001",
  "stage": "adam_spec",
  "priority": 700,
  "title": "Synthetic study TEAE window",
  "statement": "Apply the approved synthetic Study TEAE window to ADAE.TRTEMFL.",
  "source_ids": [
    "kr-adae-adverse-event-analysis",
    "pattern-treatment-emergent-ae"
  ],
  "structured_rule": {
    "rule_type": "teae_window",
    "target_dataset": "ADAE",
    "target_variable": "TRTEMFL",
    "event_start_date": "ADAE.ASTDT",
    "treatment_start_date": "ADSL.TRTSDT",
    "treatment_end_date": "ADSL.TRTEDT",
    "start_offset_days": 0,
    "end_offset_days": 30,
    "lower_bound_inclusive": true,
    "upper_bound_inclusive": true,
    "incomplete_event_date_policy": "review_required",
    "missing_treatment_date_policy": "review_required",
    "multiple_treatment_period_policy": "review_required",
    "pre_treatment_worsening_policy": "include_if_worsened"
  },
  "approval_evidence": {
    "review_id": "adam_spec_teae_rule_v1_001",
    "finding_id": "F-001",
    "packet_path": ".review_queue/archive/adam_spec_teae_rule_v1_001.json",
    "packet_sha256": "7b8c46c7ff61649f359cc7e618e2535bbcefa7e777a1c81a406c500de91d3c5b",
    "decision_path": ".review_queue/archive/adam_spec_teae_rule_v1_001_decision.json",
    "decision_sha256": "4f8df2a07b07b48ef6f5b6b887794fe87b370fcef88049b237df63c56c616b64",
    "confirmation_path": ".review_queue/archive/adam_spec_teae_rule_v1_001_confirmation.json",
    "confirmation_sha256": "a229605d6f596e95f7f063d2cef925b6df110c1b61794971b97e62c50890768f"
  },
  "content_sha256": "28fc9d2a88d1b922d1a832b2ba5cfb05e46e92ce0ab011efacd070ac3e15162a"
}
