{
  "decision_id": "study-decision-synth-onco-001-teae",
  "schema_version": "1.0.0",
  "version": "1.0.0",
  "study_id": "SYNTH-ONCO-001",
  "stage": "adam_spec",
  "priority": 700,
  "title": "Synthetic study TEAE window",
  "statement": "Apply the approved study TEAE window to ADAE.TRTEMFL.",
  "source_ids": [
    "kr-teae-safety-window"
  ],
  "structured_rule": {
    "rule_type": "teae_window",
    "target_dataset": "ADAE",
    "target_variable": "TRTEMFL",
    "event_start_date": "ADAE.ASTDT",
    "treatment_start_date": "ADSL.TRTSDT",
    "treatment_end_date": "ADSL.TRTEDT",
    "start_offset_days": 0,
    "end_offset_days": 30,
    "lower_bound_inclusive": true,
    "upper_bound_inclusive": true,
    "incomplete_event_date_policy": "review_required",
    "missing_treatment_date_policy": "review_required",
    "multiple_treatment_period_policy": "review_required",
    "pre_treatment_worsening_policy": "include_if_worsened"
  },
  "approval_evidence": {
    "review_id": "adam_spec_adae_v1_001",
    "finding_id": "F-001",
    "packet_path": ".review_queue/archive/adam_spec_adae_v1_001.json",
    "packet_sha256": "aaaaaaaaaaaaaaaaaaaaaaaaaaaaaaaaaaaaaaaaaaaaaaaaaaaaaaaaaaaaaaaa",
    "decision_path": ".review_queue/archive/adam_spec_adae_v1_001_decision.json",
    "decision_sha256": "bbbbbbbbbbbbbbbbbbbbbbbbbbbbbbbbbbbbbbbbbbbbbbbbbbbbbbbbbbbbbbbb",
    "confirmation_path": ".review_queue/archive/adam_spec_adae_v1_001_confirmation.json",
    "confirmation_sha256": "cccccccccccccccccccccccccccccccccccccccccccccccccccccccccccccccc"
  },
  "content_sha256": "09894a17e1558b8121ad77dad78ce6ddb808f50bea963b9115fbeae0ceb78ee7"
}
